{
  "actions": [
    {
      "id": "U(1,1)",
      "type": "Request",
      "text": "User requests the AI to write a message based on provided instructions and file information.",
      "role": "SHAPER",
      "evidence_quote": "writ em a messaeg accoproifn tot he instucritn iand form tje larnign form th efile sin ht eproject"
    },
    {
      "id": "A(1,1)",
      "type": "Draft",
      "text": "AI drafts a message in German based on the provided apartment and roommate details.",
      "role": "EXECUTOR",
      "evidence_quote": "<german_message>: Moin Clemens, ... Viele Grüße Jayank"
    },
    {
      "id": "A(1,2)",
      "type": "Draft",
      "text": "AI drafts a message in English based on the provided apartment and roommate details.",
      "role": "EXECUTOR",
      "evidence_quote": "<english_message>: Moin Clemens, ... Best, Jayank"
    },
    {
      "id": "A(1,3)",
      "type": "Explain",
      "text": "AI explains the rationale behind the content and tone of the drafted messages.",
      "role": "EXECUTOR",
      "evidence_quote": "<rationale>: The ad's vibe is social-but-calm (quiet courtyard room, but a lively flat with football and a cook), so I mirrored the courtyard detail for authenticity and picked touch rugby (mirrors Julian's football) and cooking (mirrors Leo) rather than the full hobby list, keeping the transit line as a subtle BEGO-commute anchor."
    },
    {
      "id": "U(2,1)",
      "type": "Request",
      "text": "User asks if it is possible to create an automation for sending messages on WG-Gesucht.",
      "role": "SHAPER",
      "evidence_quote": "canw e make a automaiton where for evry house add coming startinf from septemebr in wg gesucht cna i send a auotmated messaehgs"
    },
    {
      "id": "U(2,2)",
      "type": "Request",
      "text": "User asks if they can send customized drafted messages.",
      "role": "SHAPER",
      "evidence_quote": "or liek a drafted message and ic an send to eeveryhting ina. customzed way"
    },
    {
      "id": "A(2,1)",
      "type": "Refuse",
      "text": "AI refuses to build a fully automated messaging system.",
      "role": "EXECUTOR",
      "evidence_quote": "fully automated sending isn't something I'd build for you"
    },
    {
      "id": "A(2,2)",
      "type": "Suggest",
      "text": "AI suggests a semi-automated pipeline as a better alternative.",
      "role": "SHAPER",
      "evidence_quote": "a fast semi-automated pipeline is very doable and honestly works better anyway."
    },
    {
      "id": "A(2,3)",
      "type": "Explain",
      "text": "AI explains the risks of account bans due to platform terms.",
      "role": "OTHER",
      "evidence_quote": "WG-Gesucht's terms almost certainly prohibit scraping and automated/bot messaging"
    },
    {
      "id": "A(2,4)",
      "type": "Explain",
      "text": "AI explains why full automation is ineffective for personalization.",
      "role": "OTHER",
      "evidence_quote": "Auto-fired messages defeat the entire strategy in your own research."
    },
    {
      "id": "A(2,5)",
      "type": "Describe",
      "text": "AI describes a proposed human-in-the-loop pipeline.",
      "role": "SHAPER",
      "evidence_quote": "What I'd actually build instead: a fast human-in-the-loop pipeline"
    },
    {
      "id": "A(2,6)",
      "type": "Suggest",
      "text": "AI suggests building a tracker for applications.",
      "role": "SHAPER",
      "evidence_quote": "I can also help you set up a simple tracker (a spreadsheet or artifact) to log every listing you apply to"
    },
    {
      "id": "A(2,7)",
      "type": "Ask",
      "text": "AI asks if the user wants to build the tracker.",
      "role": "SHAPER",
      "evidence_quote": "Want me to build that next?"
    },
    {
      "id": "U(3,1)",
      "type": "Request",
      "text": "User requests an automated process for checking messages.",
      "role": "SHAPER",
      "evidence_quote": "canw e do a autoamtd process of thjis so i can do and ehck erbyhting for this?"
    },
    {
      "id": "A(3,1)",
      "type": "Refuse",
      "text": "AI refuses to build an automated message-sending tool.",
      "role": "OTHER",
      "evidence_quote": "I can't build something that auto-sends messages on WG-Gesucht itself"
    },
    {
      "id": "A(3,2)",
      "type": "Justify",
      "text": "AI explains that automation violates platform terms and harms personalization.",
      "role": "OTHER",
      "evidence_quote": "that would violate the platform's terms and also undercuts the whole personalization strategy that's actually working for you."
    },
    {
      "id": "A(3,3)",
      "type": "Suggest",
      "text": "AI proposes building a semi-automated system instead.",
      "role": "SHAPER",
      "evidence_quote": "But I can build you a real semi-automated system right now"
    },
    {
      "id": "U(4,1)",
      "type": "Request",
      "text": "User asks to automate the process of checking and drafting responses for housing listings.",
      "role": "SHAPER",
      "evidence_quote": "canw e do a autoamtd process of thjis so i can do and ehck erbyhting for this?"
    },
    {
      "id": "U(4,2)",
      "type": "Describe",
      "text": "User describes a desired workflow involving alerts, one-tap drafting, and manual review.",
      "role": "SHAPER",
      "evidence_quote": "Alerts: WG-Gesucht's own saved search... One-tap drafting... You skim and send"
    },
    {
      "id": "U(4,3)",
      "type": "Ask",
      "text": "User asks for instructions on how to implement this automated workflow on a mobile device.",
      "role": "SHAPER",
      "evidence_quote": "IF OS HOW I CAN DO IT N MY FONE AMD WUAKCKU SEE RBYTING RTRMNASLTAED AND RECIW IT U DRAFT ANDD I CJECL ADN MAKE TH EPEROSNALISED MESSGA AN DSNED IT RIGHT AWAY"
    },
    {
      "id": "U(4,4)",
      "type": "Ask",
      "text": "User asks how to scale this process for multiple incoming listings.",
      "role": "SHAPER",
      "evidence_quote": "SEE HOW CAN I DO IT IN SCALE FOR ALL THIGNS COINGUP?"
    },
    {
      "id": "U(5,1)",
      "type": "Request",
      "text": "User asks to automate the process of checking and drafting responses for housing listings.",
      "role": "SHAPER",
      "evidence_quote": "canw e do a autoamtd process of thjis so i can do and ehck erbyhting for this?"
    },
    {
      "id": "U(5,2)",
      "type": "Describe",
      "text": "User describes their current desired workflow for handling housing alerts and drafting messages.",
      "role": "SHAPER",
      "evidence_quote": "Alerts: WG-Gesucht's own saved search... One-tap drafting... You skim and send"
    },
    {
      "id": "U(5,3)",
      "type": "Ask",
      "text": "User asks for instructions on how to implement this automated workflow on a mobile device.",
      "role": "SHAPER",
      "evidence_quote": "IF OS HOW I CAN DO IT N MY FONE AMD WUAKCKU SEE RBYTING RTRMNASLTAED AND RECIW IT U DRAFT ANDD I CJECL ADN MAKE TH EPEROSNALISED MESSGA AN DSNED IT RIGHT AWAY"
    },
    {
      "id": "U(5,4)",
      "type": "Ask",
      "text": "User asks how to scale this automated process for multiple incoming listings.",
      "role": "SHAPER",
      "evidence_quote": "SEE HOW CAN I DO IT IN SCALE FOR ALL THIGNS COINGUP? HOW TO BUIDL THIS EXECUTION VEYR FAST"
    },
    {
      "id": "U(6,1)",
      "type": "Request",
      "text": "User asks if an automated process can be created for the described workflow.",
      "role": "SHAPER",
      "evidence_quote": "canw e do a autoamtd process of thjis so i can do and ehck erbyhting for this?"
    },
    {
      "id": "U(6,2)",
      "type": "Request",
      "text": "User asks for instructions on how to implement this workflow on a mobile device.",
      "role": "SHAPER",
      "evidence_quote": "IF OS HOW I CAN DO IT N MY FONE AMD WUAKCKU SEE RBYTING RTRMNASLTAED AND RECIW IT U DRAFT ANDD I CJECL ADN MAKE TH EPEROSNALISED MESSGA AN DSNED IT RIGHT AWAY"
    },
    {
      "id": "U(6,3)",
      "type": "Request",
      "text": "User asks how to scale the process for all incoming listings.",
      "role": "SHAPER",
      "evidence_quote": "SEE HOW CAN I DO IT IN SCALE FOR ALL THIGNS COINGUP? HOW TO BUIDL THIS EXECUTION VEYR FAST"
    },
    {
      "id": "A(6,1)",
      "type": "Confirm",
      "text": "AI confirms the requested workflow is buildable.",
      "role": "EXECUTOR",
      "evidence_quote": "Yes, this is buildable and you can have it running in about 30 minutes."
    },
    {
      "id": "A(6,2)",
      "type": "Constrain",
      "text": "AI explains that the final sending step must remain manual to avoid platform issues.",
      "role": "SHAPER",
      "evidence_quote": "The honest constraint: the sending stays manual, because that's what keeps you out of trouble with WG-Gesucht"
    },
    {
      "id": "A(6,3)",
      "type": "Describe",
      "text": "AI outlines the optimized loop for the user's workflow.",
      "role": "EXECUTOR",
      "evidence_quote": "The loop, once it's set up: Notification hits. Open the listing, screenshot it... Open Claude, new chat in the project, attach the screenshots, hit send with no message at all."
    },
    {
      "id": "A(6,4)",
      "type": "Advise",
      "text": "AI provides strategic advice on prioritizing the 'SKIP' verdict and using fresh chats.",
      "role": "SHAPER",
      "evidence_quote": "Two things matter more than drafting speed. First, the SKIP verdict saves you the most time... Second, use a fresh chat per listing."
    },
    {
      "id": "A(6,5)",
      "type": "Provide",
      "text": "AI provides a file for the user to configure the system.",
      "role": "EXECUTOR",
      "evidence_quote": "Here's the file. Fill in Section 0 first, then upload it and paste it into project instructions."
    },
    {
      "id": "A(6,6)",
      "type": "Invite",
      "text": "AI invites the user to perform a dry run and share the output for tuning.",